{
  "$id": "https://vanik.invalid/schemas/v1/ApprovalChallengeResponse.schema.json",
  "$schema": "https://json-schema.org/draft/2020-12/schema",
  "additionalProperties": false,
  "properties": {
    "challenge_id": {
      "format": "uuid",
      "title": "Challenge Id",
      "type": "string"
    },
    "deal_id": {
      "format": "uuid",
      "title": "Deal Id",
      "type": "string"
    },
    "deal_version": {
      "title": "Deal Version",
      "type": "integer"
    },
    "expires_at": {
      "format": "date-time",
      "title": "Expires At",
      "type": "string"
    },
    "nonce": {
      "title": "Nonce",
      "type": "string"
    },
    "terms_hash": {
      "title": "Terms Hash",
      "type": "string"
    }
  },
  "required": [
    "challenge_id",
    "deal_id",
    "deal_version",
    "terms_hash",
    "nonce",
    "expires_at"
  ],
  "title": "ApprovalChallengeResponse",
  "type": "object"
}
